{
  "family_id": "044",
  "gold_bundle_sha256": "9889fbdcce1d309449da36b5141ccdb79e64d7799bc0996a18deb425453e3063",
  "mutations": [
    {
      "artifact_hashes": {
        "successive_approximation_calibration_search_fsm.va": "6aa18a1b7623889e8478f45b993869726fcde279bc83258be4340d497580bdc5"
      },
      "certification": {
        "activated_property_ids": [
          "P_RESET_SEARCH_STATE"
        ],
        "behavior_status": "killed_behaviorally",
        "compile_status": "pass",
        "evidence_path": "negative_variants/neg_001/certification.json",
        "profile": "feedback",
        "simulation_status": "pass",
        "status": "pass"
      },
      "changed_artifacts": [
        "successive_approximation_calibration_search_fsm.va"
      ],
      "fault_class": "passes_nominal_smoke_cases_but_fails_an_endpoint",
      "id": "neg_001",
      "trigger_condition": "Passes nominal/smoke cases but fails an endpoint, threshold, saturation, or settling boundary.",
      "violated_property_ids": [
        "P_RESET_SEARCH_STATE"
      ]
    },
    {
      "artifact_hashes": {
        "successive_approximation_calibration_search_fsm.va": "ef6970d11e3bc1403d5c707bc6da68b00233a115fcda58f8999c657319ee4d3d"
      },
      "certification": {
        "activated_property_ids": [
          "P_SUCCESSIVE_STEP_HALVING"
        ],
        "behavior_status": "killed_behaviorally",
        "compile_status": "pass",
        "evidence_path": "negative_variants/neg_003/certification.json",
        "profile": "score",
        "simulation_status": "pass",
        "status": "pass"
      },
      "changed_artifacts": [
        "successive_approximation_calibration_search_fsm.va"
      ],
      "fault_class": "passes_positive_or_nominal_path_but_fails_sign_f",
      "id": "neg_003",
      "trigger_condition": "Passes positive or nominal path but fails sign, feedback direction, I/Q polarity, or trim direction.",
      "violated_property_ids": [
        "P_SUCCESSIVE_STEP_HALVING"
      ]
    },
    {
      "artifact_hashes": {
        "successive_approximation_calibration_search_fsm.va": "4ccfb07f90688aeb89909ac949128fb72b7d91f157048ea644197f5374bdc530"
      },
      "certification": {
        "activated_property_ids": [
          "P_FOUR_STEP_DONE"
        ],
        "behavior_status": "killed_behaviorally",
        "compile_status": "pass",
        "evidence_path": "negative_variants/neg_004/certification.json",
        "profile": "score",
        "simulation_status": "pass",
        "status": "pass"
      },
      "changed_artifacts": [
        "successive_approximation_calibration_search_fsm.va"
      ],
      "fault_class": "passes_steady_state_behavior_but_fails_reset_ena",
      "id": "neg_004",
      "trigger_condition": "Passes steady-state behavior but fails reset, enable, initial condition, or done/ready assertion.",
      "violated_property_ids": [
        "P_FOUR_STEP_DONE"
      ]
    },
    {
      "artifact_hashes": {
        "successive_approximation_calibration_search_fsm.va": "a4f22c688c41bb1aae41d817683b9e846a3e430f8c2dfd26969f7597369f44ae"
      },
      "certification": {
        "activated_property_ids": [
          "P_TRIM_CLAMP"
        ],
        "behavior_status": "killed_behaviorally",
        "compile_status": "pass",
        "evidence_path": "negative_variants/neg_005/certification.json",
        "profile": "score",
        "simulation_status": "pass",
        "status": "pass"
      },
      "changed_artifacts": [
        "successive_approximation_calibration_search_fsm.va"
      ],
      "fault_class": "produces_plausible_behavior_but_fails_a_metric_w",
      "id": "neg_005",
      "trigger_condition": "Produces plausible behavior but fails a metric writer, latency, count, or measurement output.",
      "violated_property_ids": [
        "P_TRIM_CLAMP"
      ]
    },
    {
      "artifact_hashes": {
        "successive_approximation_calibration_search_fsm.va": "0ef9f4cd442df353242bd24441b415c8d5bd96ac8da14df1f94983772921d9f8"
      },
      "certification": {
        "activated_property_ids": [
          "P_SIGNED_TRIAL_UPDATE"
        ],
        "behavior_status": "killed_behaviorally",
        "compile_status": "pass",
        "evidence_path": "negative_variants/neg_002/certification.json",
        "profile": "feedback",
        "simulation_status": "pass",
        "status": "pass"
      },
      "changed_artifacts": [
        "successive_approximation_calibration_search_fsm.va"
      ],
      "fault_class": "passes_interface_and_broad_waveform_checks_but_f",
      "id": "neg_002",
      "trigger_condition": "Passes interface and broad waveform checks but fails one edge, timer, sample, lock, or reacquire window.",
      "violated_property_ids": [
        "P_SIGNED_TRIAL_UPDATE"
      ]
    }
  ],
  "schema_version": "v4-mutation-catalog-v1"
}
