{
  "family_id": "381",
  "gold_bundle_sha256": "7d366e689dd93edf03ff1c62a5b30138fd498b8f8ba72339f60a1cae1bbc2817",
  "mutations": [
    {
      "artifact_hashes": {
        "fm_vco_modulation_source.va": "fa76ed172bd439812121011e503d360f25d1caaedc6f5c0c29362e7ecbb13b7b"
      },
      "certification": {
        "activated_property_ids": [
          "P_ASSERT_VALID_AFTER_THE_FIRST_COMPLETED",
          "P_OSC_OUT_MUST_TOGGLE_BETWEEN_VSS",
          "P_PHASE_MARKER_MUST_PULSE_OR_TOGGLE"
        ],
        "behavior_status": "killed_behaviorally",
        "compile_status": "pass",
        "evidence_path": "negative_variants/neg_004_threshold_shifted/certification.json",
        "profile": "feedback",
        "simulation_status": "pass",
        "status": "pass"
      },
      "changed_artifacts": [
        "fm_vco_modulation_source.va"
      ],
      "fault_class": "threshold_or_boundary_fault",
      "id": "neg_004_threshold_shifted",
      "trigger_condition": "semantic threshold mutation from gold",
      "violated_property_ids": [
        "P_ASSERT_VALID_AFTER_THE_FIRST_COMPLETED",
        "P_OSC_OUT_MUST_TOGGLE_BETWEEN_VSS",
        "P_PHASE_MARKER_MUST_PULSE_OR_TOGGLE"
      ]
    },
    {
      "artifact_hashes": {
        "fm_vco_modulation_source.va": "6eb07535c312d9e61da78407feac4a1e6e1392fb2b819f910add4c576046d4b2"
      },
      "certification": {
        "activated_property_ids": [
          "P_ASSERT_VALID_AFTER_THE_FIRST_COMPLETED",
          "P_OSC_OUT_MUST_TOGGLE_BETWEEN_VSS",
          "P_PHASE_MARKER_MUST_PULSE_OR_TOGGLE",
          "P_WHEN_ENABLED_GENERATE_A_DETERMINISTIC_BEHAVIOR"
        ],
        "behavior_status": "killed_behaviorally",
        "compile_status": "pass",
        "evidence_path": "negative_variants/neg_001_zero/certification.json",
        "profile": "score",
        "simulation_status": "pass",
        "status": "pass"
      },
      "changed_artifacts": [
        "fm_vco_modulation_source.va"
      ],
      "fault_class": "zero_stub_output",
      "id": "neg_001_zero",
      "trigger_condition": "semantic zero mutation from gold",
      "violated_property_ids": [
        "P_ASSERT_VALID_AFTER_THE_FIRST_COMPLETED",
        "P_OSC_OUT_MUST_TOGGLE_BETWEEN_VSS",
        "P_PHASE_MARKER_MUST_PULSE_OR_TOGGLE",
        "P_WHEN_ENABLED_GENERATE_A_DETERMINISTIC_BEHAVIOR"
      ]
    },
    {
      "artifact_hashes": {
        "fm_vco_modulation_source.va": "31bde57bc3e35a60be86491a5e4398050811ffe0487d13ac08d46a15e9a989db"
      },
      "certification": {
        "activated_property_ids": [
          "P_ASSERT_VALID_AFTER_THE_FIRST_COMPLETED",
          "P_OSC_OUT_MUST_TOGGLE_BETWEEN_VSS",
          "P_PHASE_MARKER_MUST_PULSE_OR_TOGGLE",
          "P_WHEN_ENABLED_GENERATE_A_DETERMINISTIC_BEHAVIOR"
        ],
        "behavior_status": "killed_behaviorally",
        "compile_status": "pass",
        "evidence_path": "negative_variants/neg_002_half_scale/certification.json",
        "profile": "score",
        "simulation_status": "pass",
        "status": "pass"
      },
      "changed_artifacts": [
        "fm_vco_modulation_source.va"
      ],
      "fault_class": "metric_or_observable_fault",
      "id": "neg_002_half_scale",
      "trigger_condition": "semantic scale mutation from gold",
      "violated_property_ids": [
        "P_ASSERT_VALID_AFTER_THE_FIRST_COMPLETED",
        "P_OSC_OUT_MUST_TOGGLE_BETWEEN_VSS",
        "P_PHASE_MARKER_MUST_PULSE_OR_TOGGLE",
        "P_WHEN_ENABLED_GENERATE_A_DETERMINISTIC_BEHAVIOR"
      ]
    },
    {
      "artifact_hashes": {
        "fm_vco_modulation_source.va": "6538f38541deea0b5569e9dd1d31e319f049984b2b742542057e26f49c2800fa"
      },
      "certification": {
        "activated_property_ids": [
          "P_ASSERT_VALID_AFTER_THE_FIRST_COMPLETED",
          "P_PHASE_MARKER_MUST_PULSE_OR_TOGGLE"
        ],
        "behavior_status": "killed_behaviorally",
        "compile_status": "pass",
        "evidence_path": "negative_variants/neg_005_event_edge_wrong/certification.json",
        "profile": "score",
        "simulation_status": "pass",
        "status": "pass"
      },
      "changed_artifacts": [
        "fm_vco_modulation_source.va"
      ],
      "fault_class": "phase_marker_on_falling_half_cycle",
      "id": "neg_005_event_edge_wrong",
      "trigger_condition": "phase marker toggles on falling oscillator half-cycles",
      "violated_property_ids": [
        "P_ASSERT_VALID_AFTER_THE_FIRST_COMPLETED",
        "P_PHASE_MARKER_MUST_PULSE_OR_TOGGLE"
      ]
    },
    {
      "artifact_hashes": {
        "fm_vco_modulation_source.va": "59806efed6d4158bad8d056e5faaa583d7bf487cafa8a001f4516c4bf752dcc4"
      },
      "certification": {
        "activated_property_ids": [
          "P_ASSERT_VALID_AFTER_THE_FIRST_COMPLETED",
          "P_OSC_OUT_MUST_TOGGLE_BETWEEN_VSS",
          "P_PHASE_MARKER_MUST_PULSE_OR_TOGGLE",
          "P_WHEN_ENABLED_GENERATE_A_DETERMINISTIC_BEHAVIOR"
        ],
        "behavior_status": "killed_behaviorally",
        "compile_status": "pass",
        "evidence_path": "negative_variants/neg_003_inverted_transfer/certification.json",
        "profile": "feedback",
        "simulation_status": "pass",
        "status": "pass"
      },
      "changed_artifacts": [
        "fm_vco_modulation_source.va"
      ],
      "fault_class": "polarity_or_direction_error",
      "id": "neg_003_inverted_transfer",
      "trigger_condition": "semantic invert mutation from gold",
      "violated_property_ids": [
        "P_ASSERT_VALID_AFTER_THE_FIRST_COMPLETED",
        "P_OSC_OUT_MUST_TOGGLE_BETWEEN_VSS",
        "P_PHASE_MARKER_MUST_PULSE_OR_TOGGLE",
        "P_WHEN_ENABLED_GENERATE_A_DETERMINISTIC_BEHAVIOR"
      ]
    }
  ],
  "schema_version": "v4-mutation-catalog-v1"
}
