{
  "family_id": "205",
  "gold_bundle_sha256": "2ffa63966104ed9cc682f4c7472cf56cc96045069fc9901d0b8b4f6b2650868b",
  "mutations": [
    {
      "artifact_hashes": {
        "offset_halving_search.va": "25aa3569b23505cd8baf64d9da99c1b09974ffec98d9bf8dfb6a56cbf0467189"
      },
      "certification": {
        "activated_property_ids": [
          "P_INITIALIZE_THE_DIFFERENTIAL_TRIM_RESIDUE_TO"
        ],
        "behavior_status": "killed_behaviorally",
        "compile_status": "pass",
        "evidence_path": "negative_variants/neg_002_no_step_halving/certification.json",
        "profile": "feedback",
        "simulation_status": "pass",
        "status": "pass"
      },
      "changed_artifacts": [
        "offset_halving_search.va"
      ],
      "fault_class": "threshold_or_boundary_fault",
      "id": "neg_002_no_step_halving",
      "trigger_condition": "Keeps the offset search step fixed after each clock.",
      "violated_property_ids": [
        "P_INITIALIZE_THE_DIFFERENTIAL_TRIM_RESIDUE_TO"
      ]
    },
    {
      "artifact_hashes": {
        "offset_halving_search.va": "9a3bdfcd7a33e8a688f8b46b3b6b616be13895520a070e1aa95e8a9686713b37"
      },
      "certification": {
        "activated_property_ids": [
          "P_INITIALIZE_THE_DIFFERENTIAL_TRIM_RESIDUE_TO"
        ],
        "behavior_status": "killed_behaviorally",
        "compile_status": "pass",
        "evidence_path": "negative_variants/neg_001_zero/certification.json",
        "profile": "score",
        "simulation_status": "pass",
        "status": "pass"
      },
      "changed_artifacts": [
        "offset_halving_search.va"
      ],
      "fault_class": "zero_stub_output",
      "id": "neg_001_zero",
      "trigger_condition": "Drives zero output and therefore fails the stable waveform contract.",
      "violated_property_ids": [
        "P_INITIALIZE_THE_DIFFERENTIAL_TRIM_RESIDUE_TO"
      ]
    },
    {
      "artifact_hashes": {
        "offset_halving_search.va": "62677b26f8675519b5d66da305b92aa12e854acbaa4a4b1d32e767d88500ef80"
      },
      "certification": {
        "activated_property_ids": [
          "P_INITIALIZE_THE_DIFFERENTIAL_TRIM_RESIDUE_TO"
        ],
        "behavior_status": "killed_behaviorally",
        "compile_status": "pass",
        "evidence_path": "negative_variants/neg_004_full_diff_scale/certification.json",
        "profile": "score",
        "simulation_status": "pass",
        "status": "pass"
      },
      "changed_artifacts": [
        "offset_halving_search.va"
      ],
      "fault_class": "metric_or_observable_fault",
      "id": "neg_004_full_diff_scale",
      "trigger_condition": "Uses full differential vin instead of half-scale around common mode.",
      "violated_property_ids": [
        "P_INITIALIZE_THE_DIFFERENTIAL_TRIM_RESIDUE_TO"
      ]
    },
    {
      "artifact_hashes": {
        "offset_halving_search.va": "3962eef4ba4942347a0ec526134e29f06f671d3372c18f1cbbd577ef0d5ccdad"
      },
      "certification": {
        "activated_property_ids": [
          "P_INITIALIZE_THE_DIFFERENTIAL_TRIM_RESIDUE_TO"
        ],
        "behavior_status": "killed_behaviorally",
        "compile_status": "pass",
        "evidence_path": "negative_variants/neg_003_inverted_update/certification.json",
        "profile": "feedback",
        "simulation_status": "pass",
        "status": "pass"
      },
      "changed_artifacts": [
        "offset_halving_search.va"
      ],
      "fault_class": "polarity_or_direction_error",
      "id": "neg_003_inverted_update",
      "trigger_condition": "Moves vin in the opposite direction for each comparator decision.",
      "violated_property_ids": [
        "P_INITIALIZE_THE_DIFFERENTIAL_TRIM_RESIDUE_TO"
      ]
    },
    {
      "artifact_hashes": {
        "offset_halving_search.va": "d84f3c9eb7b2ee9dc83891662f85d1d52c1351701d4625bc495fb06a28fcceb8"
      },
      "certification": {
        "activated_property_ids": [
          "P_INITIALIZE_THE_DIFFERENTIAL_TRIM_RESIDUE_TO"
        ],
        "behavior_status": "killed_behaviorally",
        "compile_status": "pass",
        "evidence_path": "negative_variants/neg_005_metric_scale_low/certification.json",
        "profile": "score",
        "simulation_status": "pass",
        "status": "pass"
      },
      "changed_artifacts": [
        "offset_halving_search.va"
      ],
      "fault_class": "threshold_or_boundary_fault",
      "id": "neg_005_metric_scale_low",
      "trigger_condition": "Offset Halving Search: scales the metric output, preserving the main path while failing measurement checks.",
      "violated_property_ids": [
        "P_INITIALIZE_THE_DIFFERENTIAL_TRIM_RESIDUE_TO"
      ]
    }
  ],
  "schema_version": "v4-mutation-catalog-v1"
}
